"Summary","Issue Type","Description","Labels","Priority","Components","Epic Link"
"Exam results and grading breakdown","Story","# 1. Tong quan & Bói cảnh (Overview & Context)\n## Problem\nCan xem ket qua va breakdown.\n---\n## Pain Points\n- Thieu thong tin phan hoi\n---\n## Business Value\n- Minh bach diem so\n---\n## Actors\n### Primary Actor\nSTUDENT/LECTURER/ADMIN\n---\n## User Story Statement\nLa mot Nguoi dung, toi muon xem ket qua va breakdown diem.\n---\n# 2. User Flow\n## 2.1 Luong chinh: Results\n1. Mo Exam Results\n2. Goi GET /api/submissions/exam/:examId\n---\n# 3. Exception Flow\nN/A\n---\n# 4. Acceptance Criteria\n## AC-01 – Hien thi ket qua\nGiven du lieu When view Then hien thi breakdown\n---\n# 5. API\nGET /api/submissions/exam/:examId\nGET /api/submissions/exam/:examId/my-submission\n---\n# 6. Database Table\nSubmissions\n---\n# 7. Business Rule\nSinh vien chi xem ket qua cua minh.","scope,results,grading,implemented","Medium","Submissions","Submission and grading workflow"
"Exam monitoring for lecturers","Story","# 1. Tong quan & Bói cảnh (Overview & Context)\n## Problem\nCan giam sat ky thi theo thoi gian thuc.\n---\n## Pain Points\n- Khong phat hien su co kip thoi\n---\n## Business Value\n- Tang do tin cay ky thi\n---\n## Actors\n### Primary Actor\nLECTURER/ADMIN\n---\n## User Story Statement\nLa mot Giang vien, toi muon giam sat exam dang dien ra.\n---\n# 2. User Flow\n## 2.1 Luong chinh: Monitor\n1. Mo Exam Monitor\n2. Xem event timeline\n---\n# 3. Exception Flow\nN/A\n---\n# 4. Acceptance Criteria\n## AC-01 – Hien thi su kien\nGiven exam hoat dong When view Then hien thi event\n---\n# 5. API\nGET /api/submissions/exam/:examId\n---\n# 6. Database Table\nSubmissions, ProctoringSession\n---\n# 7. Business Rule\nChi nguoi co quyen moi xem monitor.","scope,integrity,monitoring,implemented","High","Integrity","Integrity monitoring and audit"
"Admin integrity overview","Story","# 1. Tong quan & Bói cảnh (Overview & Context)\n## Problem\nCan tong hop integrity cases.\n---\n## Pain Points\n- Kho theo doi vi pham\n---\n## Business Value\n- Tang minh bach va kiem soat\n---\n## Actors\n### Primary Actor\nADMIN\n---\n## User Story Statement\nLa mot Admin, toi muon xem tong hop integrity cases.\n---\n# 2. User Flow\n## 2.1 Luong chinh: Integrity overview\n1. Mo Integrity Overview\n2. Xem danh sach case\n---\n# 3. Exception Flow\nN/A\n---\n# 4. Acceptance Criteria\n## AC-01 – Hien thi case\nGiven du lieu When view Then hien thi danh sach\n---\n# 5. API\nN/A (UI\n---\n# 6. Database Table\nN/A\n---\n# 7. Business Rule\nChi ADMIN duoc xem tong hop.","scope,integrity,admin,implemented","High","Integrity","Integrity monitoring and audit"
"Audit log viewer","Story","# 1. Tong quan & Bói cảnh (Overview & Context)\n## Problem\nCan truy vet su kien he thong.\n---\n## Pain Points\n- Thieu audit log de dieu tra\n---\n## Business Value\n- Minh bach he thong\n---\n## Actors\n### Primary Actor\nADMIN\n---\n## User Story Statement\nLa mot Admin, toi muon xem audit log de truy vet.\n---\n# 2. User Flow\n## 2.1 Luong chinh: Audit log\n1. Mo Audit Log\n2. Loc va xem chi tiet\n---\n# 3. Exception Flow\nN/A\n---\n# 4. Acceptance Criteria\n## AC-01 – Hien thi audit log\nGiven du lieu When view Then hien thi log\n---\n# 5. API\nN/A\n---\n# 6. Database Table\nN/A\n---\n# 7. Business Rule\nLog khong duoc sua xoa tu UI.","scope,audit,logging,implemented","Medium","Integrity","Integrity monitoring and audit"
"Transparency dashboard and methodology reference","Story","# 1. Tong quan & Bói cảnh (Overview & Context)\n## Problem\nCan cung cap dashboard minh bach.\n---\n## Pain Points\n- Khong ro metric tinh nhu the nao\n---\n## Business Value\n- Tang do tin cay\n---\n## Actors\n### Primary Actor\nADMIN/LECTURER\n---\n## User Story Statement\nLa mot Nguoi quan ly, toi muon xem dashboard minh bach va methodology.\n---\n# 2. User Flow\n## 2.1 Luong chinh: Transparency\n1. Mo Transparency Dashboard\n2. Xem methodology reference\n---\n# 3. Exception Flow\nN/A\n---\n# 4. Acceptance Criteria\n## AC-01 – Hien thi dashboard\nGiven du lieu When view Then hien thi metric\n---\n# 5. API\nN/A\n---\n# 6. Database Table\nN/A\n---\n# 7. Business Rule\nNo edit trong dashboard.","scope,transparency,analytics,implemented","Medium","Analytics","Analytics and transparency dashboards"
"Role based dashboards","Story","# 1. Tong quan & Bói cảnh (Overview & Context)\n## Problem\nCan dashboard theo vai tro.\n---\n## Pain Points\n- Thong tin bi lan lon neu dung chung\n---\n## Business Value\n- Hien thi KPI dung doi tuong\n---\n## Actors\n### Primary Actor\nADMIN/LECTURER/STUDENT\n---\n## User Story Statement\nLa mot Nguoi dung, toi muon dashboard phu hop vai tro.\n---\n# 2. User Flow\n## 2.1 Luong chinh: Role dashboard\n1. Dang nhap\n2. He thong dieu huong den dashboard dung role\n---\n# 3. Exception Flow\nN/A\n---\n# 4. Acceptance Criteria\n## AC-01 – Hien thi dung dashboard\nGiven role When login Then thay dashboard dung\n---\n# 5. API\nN/A\n---\n# 6. Database Table\nN/A\n---\n# 7. Business Rule\nChi mot dashboard cho moi role.","scope,dashboard,role-based,implemented","Medium","Analytics","Analytics and transparency dashboards"
"AI document upload and generation support","Story","# 1. Tong quan & Bói cảnh (Overview & Context)\n## Problem\nCan tai tai lieu de AI ho tro tao cau hoi.\n---\n## Pain Points\n- Tao cau hoi thu cong ton thoi gian\n---\n## Business Value\n- Tang hieu suat ra de\n---\n## Actors\n### Primary Actor\nLECTURER/ADMIN\n---\n## User Story Statement\nLa mot Giang vien, toi muon tai tai lieu de AI ho tro.\n---\n# 2. User Flow\n## 2.1 Luong chinh: Upload doc\n1. Mo UploadDocAIGen\n2. Chon file\n3. Upload va xu ly\n---\n# 3. Exception Flow\n## EF-01 – File khong hop le\nThong bao loi\n---\n# 4. Acceptance Criteria\n## AC-01 – Upload thanh cong\nGiven file hop le When upload Then tai lieu duoc xu ly\n---\n# 5. API\nPOST /api/ai/... (neu co)\n---\n# 6. Database Table\nN/A\n---\n# 7. Business Rule\nChi role duoc phep moi upload.","scope,ai,document,implemented","Medium","AI","AI assisted exam utilities"
"Local AI server integration","Story","# 1. Tong quan & Bói cảnh (Overview & Context)\n## Problem\nCan ket noi local AI server cho tinh nang ho tro.\n---\n## Pain Points\n- Khong co backend AI thi khong the sinh goi y\n---\n## Business Value\n- Tang toc do phat trien\n---\n## Actors\n### Primary Actor\nSystem\n---\n## User Story Statement\nLa mot He thong, toi muon goi local AI server de ho tro tinh nang AI.\n---\n# 2. User Flow\n## 2.1 Luong chinh: AI integration\n1. Backend goi local_ai_server\n2. Nhan ket qua\n---\n# 3. Exception Flow\n## EF-01 – Server khong phan hoi\nTra 500\n---\n# 4. Acceptance Criteria\n## AC-01 – Tich hop thanh cong\nGiven server online When call Then tra ket qua\n---\n# 5. API\nN/A (internal)\n---\n# 6. Database Table\nN/A\n---\n# 7. Business Rule\nChi dung cho moi truong dev khi can.","scope,ai,integration,implemented","Medium","AI","AI assisted exam utilities"
"Prisma schema migrations and seed data","Task","# 1. Tong quan & Bói cảnh (Overview & Context)\n## Problem\nCan thiet lap schema va seed du lieu.\n---\n## Pain Points\n- Moi truong khong dong nhat\n---\n## Business Value\n- Khoi tao nhanh\n---\n## Actors\n### Primary Actor\nDeveloper\n---\n## User Story Statement\nLa mot Dev, toi muon co migration va seed de khoi tao nhanh.\n---\n# 2. User Flow\n## 2.1 Luong chinh: Setup\n1. Chay prisma migrate\n2. Chay seed\n---\n# 3. Exception Flow\n## EF-01 – Migration fail\nTra loi va rollback\n---\n# 4. Acceptance Criteria\n## AC-01 – Setup thanh cong\nGiven DB trong When migrate Then schema duoc tao\n---\n# 5. API\nN/A\n---\n# 6. Database Table\nTat ca bang\n---\n# 7. Business Rule\nSeed chi chay o moi truong dev.","scope,prisma,database,implemented","High","Platform","Platform setup and seed data"
"Backend API documentation","Task","# 1. Tong quan & Bói cảnh (Overview & Context)\n## Problem\nCan tai lieu hoa API cho handoff.\n---\n## Pain Points\n- Thieu tai lieu de test\n---\n## Business Value\n- Giam thoi gian giao tiep\n---\n## Actors\n### Primary Actor\nDeveloper/QA\n---\n## User Story Statement\nLa mot Nguoi phat trien, toi muon tai lieu API de test nhanh.\n---\n# 2. User Flow\n## 2.1 Luong chinh: Doc API\n1. Mo tai lieu\n2. Tham khao endpoint\n---\n# 3. Exception Flow\nN/A\n---\n# 4. Acceptance Criteria\n## AC-01 – Tai lieu day du\nGiven API When doc Then co endpoint va vi du\n---\n# 5. API\nN/A\n---\n# 6. Database Table\nN/A\n---\n# 7. Business Rule\nTai lieu can cap nhat khi API thay doi.","scope,docs,api,implemented","Medium","Platform","Platform setup and seed data"
